{
  "id": "EO-001",
  "slug": "add-ladder-climbing-enemy",
  "title": "Add ladder-climbing enemy",
  "tier": "deep",
  "tierReason": "Shared contract changed (Enemy.spawn); new subsystem (climb state machine); 8 files touched",
  "phase": "implement",
  "branch": "feat/eo-001-ladder-climbing-enemy",
  "budgetTokens": 250000,
  "gates": {
    "scope":   { "required": true, "status": "approved", "by": "Project Owner", "at": "2026-08-06", "conditions": ["C-1", "C-2"] },
    "design":  { "required": true, "status": "approved", "by": "Project Owner", "at": "2026-08-07", "conditions": ["C-3", "C-4"] },
    "release": { "required": true, "status": "pending" }
  },
  "wp": [
    { "id": "WP-01", "title": "Ladder domain model", "status": "done", "touches": ["phefo/js/levels/level.js"], "deps": [], "refs": ["AD-003"] },
    { "id": "WP-02", "title": "Ladder rendering", "status": "todo", "touches": ["phefo/js/levels/level.js"], "deps": ["WP-01"], "refs": ["AD-003"] },
    { "id": "WP-03", "title": "Ladder placement in level01_city", "status": "todo", "touches": ["phefo/js/levels/level01_city.js"], "deps": ["WP-02"], "refs": ["BD-009"] },
    { "id": "WP-04", "title": "ASM-001 constructor hook", "status": "todo", "touches": ["phefo/js/entities/enemy.js"], "deps": [], "refs": ["AD-002"] },
    { "id": "WP-05", "title": "World ladder exposure", "status": "todo", "touches": ["phefo/js/core/game.js"], "deps": ["WP-01"], "refs": ["AD-003"] },
    { "id": "WP-06", "title": "Climber skeleton, registration, load order", "status": "todo", "touches": ["phefo/js/entities/climber.js", "phefo/js/entities/enemies/climber.js", "phefo/index.html"], "deps": ["WP-04"], "refs": ["AD-001", "INV-4"] },
    { "id": "WP-07", "title": "Elevation model", "status": "todo", "touches": ["phefo/js/entities/climber.js"], "deps": ["WP-06"], "refs": ["AD-004"] },
    { "id": "WP-08", "title": "Ladder selection and APPROACH", "status": "todo", "touches": ["phefo/js/entities/climber.js"], "deps": ["WP-05", "WP-07"], "refs": ["AD-006", "BD-004"] },
    { "id": "WP-09", "title": "Ascent, exit contract, housekeeping", "status": "todo", "touches": ["phefo/js/entities/climber.js"], "deps": ["WP-08"], "refs": ["AD-005", "AD-007", "AD-009"] },
    { "id": "WP-10", "title": "Climb pose", "status": "todo", "touches": ["phefo/js/render/poses.js", "phefo/js/entities/climber.js"], "deps": ["WP-09"], "refs": ["AD-010"] },
    { "id": "WP-11", "title": "Descent", "status": "todo", "touches": ["phefo/js/entities/climber.js"], "deps": ["WP-09"], "refs": ["BD-007"] },
    { "id": "WP-12", "title": "Wave placement", "status": "todo", "touches": ["phefo/js/levels/level01_city.js"], "deps": ["WP-11"], "refs": ["BD-012", "BD-019"] },
    { "id": "WP-13", "title": "Tuning, checklist and evidence", "status": "todo", "touches": ["phefo/js/entities/enemies/climber.js"], "deps": ["WP-12"], "refs": ["BD-011", "BD-015"] }
  ],
  "context": {
    "always": ["engineering/project-context/index.md", "engineering/project-context/invariants.md", "engineering/standards.md"],
    "analyst": ["brief.md"],
    "architect": ["brief.md", "decisions.md", "engineering/project-context/architecture.md", "engineering/project-context/domain.md"],
    "engineer": ["state.json", "wp/<current>.md"],
    "reviewer": ["wp/<current>.md", "brief.md#success-criteria", "plan.md#validation-gates"]
  },
  "openQuestions": 0,
  "ctxGaps": [],
  "updated": "2026-08-09"
}
